{
    "feedFormat": "gtfs",
    "onestopId": "f-9q5-lacmta",
    "operatorsInFeed": [
        {
            "gtfsAgencyId": "metrolosangeles",
            "onestopId": "o-9q5-metrolosangeles"
        }
    ],
    "sha1": "201b718c6b8e08910da24d5714a1ac9287698b4a",
    "tags": {},
    "url": "http://developer.metro.net/gtfs/google_transit.zip"
}