{
    "feedFormat": "gtfs",
    "onestopId": "f-c28-translink",
    "operatorsInFeed": [
        {
            "gtfsAgencyId": "westcoastexpress",
            "onestopId": "o-c2b-westcoastexpress"
        },
        {
            "gtfsAgencyId": "britishcolumbiarapidtransitcompany",
            "onestopId": "o-c2b8-britishcolumbiarapidtransitcompany"
        },
        {
            "gtfsAgencyId": "translink",
            "onestopId": "o-c28-translink"
        }
    ],
    "sha1": "066a5724657578e0b5efa2f830f27aa637974b58",
    "tags": {},
    "url": "http://mapexport.translink.bc.ca/current/google_transit.zip"
}