{
  "onestopId": "f-9q9-VTA",
  "url": "http://www.vta.org/sfc/servlet.shepherd/document/download/069A0000001NUea",
  "feedFormat": "gtfs",
  "tags": {
    "licenseUrl": "http://www.sfmta.com/about-sfmta/reports/gtfs-transit-data",
    "downloadPageUrl": "http://www.vta.org/getting-around/gtfs-info/data-file"
  },
  "operatorsInFeed": [
    {
      "onestopId": "o-9q9-VTA",
      "gtfsAgencyId": "VTA"
    }
  ]
}
