{
  "feedFormat": "gtfs",
  "onestopId": "f-9vk-mtaharriscounty",
  "operatorsInFeed": [
    {
      "gtfsAgencyId": "metropolitantransitauthorityofharriscounty",
      "onestopId": "o-9vk-metropolitantransitauthorityofharriscounty",
      "identifiers": [
        "usntd://6008"
      ]
    }
  ],
  "tags": {},
  "url": "http://www.ridemetro.org/News/Downloads/DataFiles/google_transit.zip"
}
