{
    "feedFormat": "gtfs",
    "onestopId": "f-c20-trimet",
    "operatorsInFeed": [
        {
            "gtfsAgencyId": "trimet",
            "onestopId": "o-c20-trimet"
        }
    ],
    "sha1": "4e918ec81d80b5da6f7c35c35af0c16f74566d58",
    "tags": {},
    "url": "http://developer.trimet.org/schedule/gtfs.zip"
}