{
  "onestopId": "f-9q8y-SFMTA",
  "url": "http://archives.sfmta.com/transitdata/google_transit.zip",
  "feedFormat": "gtfs",
  "tags": {
    "licenseUrl": "http://www.sfmta.com/about-sfmta/reports/gtfs-transit-data"
  },
  "operatorsInFeed": [
    {
      "onestopId": "o-9q8y-SFMTA",
      "gtfsAgencyId": "SFMTA"
    }
  ]
}
