{
  "feedFormat": "gtfs",
  "onestopId": "f-9q9-bayarearapidtransit",
  "operatorsInFeed": [
    {
      "gtfsAgencyId": "BART",
      "onestopId": "o-9q9-bayarearapidtransit",
      "identifiers": [
        "usntd://9003"
      ]
    }
  ],
  "tags": {},
  "url": "http://www.bart.gov/dev/schedules/google_transit.zip"
}
