{
  "feedFormat": "gtfs",
  "onestopId": "f-dnh-marta",
  "operatorsInFeed": [
    {
      "gtfsAgencyId": "metropolitanatlantarapidtransitauthority",
      "onestopId": "o-dnh-metropolitanatlantarapidtransitauthority",
      "identifiers": [
        "usntd://4022"
      ]
    }
  ],
  "tags": {},
  "url": "http://www.itsmarta.com/google_transit_feed/google_transit.zip"
}
