{
  "feedFormat": "gtfs",
  "onestopId": "f-dhw-miamidade",
  "operatorsInFeed": [
    {
      "gtfsAgencyId": "Miami Dade Transit",
      "onestopId": "o-dhw-miamidadetransit",
      "identifiers": [
        "usntd://4034"
      ]
    }
  ],
  "tags": {},
  "url": "http://www.miamidade.gov/transit/googletransit/current/google_transit.zip"
}
