{
    "feedFormat": "gtfs",
    "onestopId": "f-drt-mbta",
    "operatorsInFeed": [
        {
            "gtfsAgencyId": "massport",
            "onestopId": "o-drt3p-massport"
        },
        {
            "gtfsAgencyId": "mbta",
            "onestopId": "o-drt-mbta"
        }
    ],
    "sha1": "d2b8860304aa3eb12fefa8a581f5c6dee978a6bc",
    "tags": {},
    "url": "http://www.mbta.com/uploadedfiles/MBTA_GTFS.zip"
}