{
  "onestopId": "f-9q9-BART",
  "url": "http://www.bart.gov/dev/schedules/google_transit.zip",
  "feedFormat": "gtfs",
  "tags": {
    "licenseUrl": "http://www.bart.gov/schedules/developers/developer-license-agreement",
    "downloadPageUrl": "http://www.bart.gov/schedules/developers/gtfs",
    "gtfs_data_exchange_id": "bay-area-rapid-transit"
  },
  "operatorsInFeed": [
    {
      "onestopId": "o-9q9-BART",
      "gtfsAgencyId": "BART"
    }
  ]
}
