{
    "feedFormat": "gtfs",
    "onestopId": "f-9q8-samtrans",
    "operatorsInFeed": [
        {
            "gtfsAgencyId": "samtrans",
            "onestopId": "o-9q8-samtrans"
        }
    ],
    "sha1": "535c2fd10837c1c9eba48cfd475509ae1868dc08",
    "tags": {
        "downloadPageUrl": "http://www.samtrans.com/Developer/DLA-PP-SamTrans.html?IsSubmitted=True",
        "licenseUrl": "http://www.samtrans.com/Developer/DLA-PP-SamTrans.html"
    },
    "url": "http://www.samtrans.com/Assets/GTFS/samtrans/SamTrans-GTFS.zip"
}