{
    "feedFormat": "gtfs",
    "onestopId": "f-9mu-mtssandiego",
    "operatorsInFeed": [
        {
            "gtfsAgencyId": "mts",
            "onestopId": "o-9mu-mts"
        }
    ],
    "sha1": "2193fe822834db036fbb951fd1c267560e6de6ff",
    "tags": {},
    "url": "http://www.sdmts.com/google_transit_files/google_transit.zip"
}