{
  "feedFormat": "gtfs",
  "onestopId": "f-dq-mtamaryland",
  "operatorsInFeed": [
    {
      "gtfsAgencyId": "mtaofficeoflocaltransitsupport",
      "onestopId": "o-dq-mtaofficeoflocaltransitsupport",
      "identifiers": []
    },
    {
      "gtfsAgencyId": "marylandtransitadministration",
      "onestopId": "o-dqc-marylandtransitadministration",
      "identifiers": [
        "usntd://3034"
      ]
    }
  ],
  "tags": {},
  "url": "http://mta.maryland.gov/_googletransit/latest/google_transit.zip"
}
