{
    "feedFormat": "gtfs",
    "onestopId": "f-9q9-vta",
    "operatorsInFeed": [
        {
            "gtfsAgencyId": "vta",
            "onestopId": "o-9q9-vta"
        }
    ],
    "sha1": "5ac0244cec6ae8dc7e06f6d277e4634f46e6b01c",
    "tags": {
        "downloadPageUrl": "http://www.vta.org/getting-around/gtfs-info/data-file",
        "licenseUrl": "http://www.sfmta.com/about-sfmta/reports/gtfs-transit-data"
    },
    "url": "http://www.vta.org/sfc/servlet.shepherd/document/download/069A0000001NUea"
}