{
  "feedFormat": "gtfs",
  "onestopId": "f-c28-translink",
  "operatorsInFeed": [
    {
      "gtfsAgencyId": "translink",
      "onestopId": "o-c28-translink",
      "identifiers": []
    },
    {
      "gtfsAgencyId": "westcoastexpress",
      "onestopId": "o-c2b-westcoastexpress",
      "identifiers": []
    },
    {
      "gtfsAgencyId": "britishcolumbiarapidtransitcompany",
      "onestopId": "o-c2b8-britishcolumbiarapidtransitcompany",
      "identifiers": []
    }
  ],
  "sha1": "ae9eacad3c75b7fb9e506eacc5bed97ee5b965c2",
  "tags": {},
  "url": "http://mapexport.translink.bc.ca/current/google_transit.zip"
}
