{
  "onestopId": "f-9q9-SamTrans",
  "url": "http://www.samtrans.com/Assets/GTFS/samtrans/SamTrans-GTFS-RB115-rev-08252014.zip",
  "feedFormat": "gtfs",
  "tags": {
    "licenseUrl": "http://www.samtrans.com/Developer/DLA-PP-SamTrans.html",
    "downloadPageUrl": "http://www.samtrans.com/Developer/DLA-PP-SamTrans.html?IsSubmitted=True"
  },
  "operatorsInFeed": [
    {
      "onestopId": "o-9q9-SamTrans",
      "gtfsAgencyId": "SamTrans"
    }
  ]
}
