{
  "onestopId": "f-9q9-ACTransit",
  "url": "http://www.actransit.org/wp-content/uploads/gtfsdec072014b.zip",
  "feedFormat": "gtfs",
  "tags": {
    "license": "Creative Commons Attribution 3.0 Unported License",
    "licenseUrl": "http://www.actransit.org/data-terms-and-conditions/"
  },
  "operatorsInFeed": [
    {
      "onestopId": "o-9q9-ACTransit",
      "gtfsAgencyId": "AC Transit"
    }
  ]
}
