{
    "feedFormat": "gtfs",
    "onestopId": "f-dqc-fwmata",
    "operatorsInFeed": [
        {
            "gtfsAgencyId": "dccirculator",
            "onestopId": "o-dqcjr-dccirculator"
        },
        {
            "gtfsAgencyId": "met",
            "onestopId": "o-dqc-met"
        }
    ],
    "sha1": "1827b2feceb1d9d2f2d69fbb984220675499e19d",
    "tags": {},
    "url": "http://lrg.wmata.com/GTFS_data/google_transit.zip"
}