{
    "feedFormat": "gtfs",
    "onestopId": "f-dr5r-mtanyctbusbrooklyn",
    "operatorsInFeed": [
        {
            "gtfsAgencyId": "MTA NYCT",
            "identifiers": [],
            "onestopId": "o-dr5r-mtanewyorkcitytransit"
        }
    ],
    "tags": {},
    "url": "http://web.mta.info/developers/data/nyct/bus/google_transit_brooklyn.zip"
}