{
    "feedFormat": "gtfs",
    "onestopId": "f-dhw-miamidade",
    "operatorsInFeed": [
        {
            "gtfsAgencyId": "miamidadetransit",
            "onestopId": "o-dhw-miamidadetransit"
        }
    ],
    "sha1": "f30f191d45b27493b77a99a23a25be2bd87bbad5",
    "tags": {},
    "url": "http://www.miamidade.gov/transit/googletransit/current/google_transit.zip"
}