{
    "feedFormat": "gtfs",
    "onestopId": "f-dq-mtamaryland",
    "operatorsInFeed": [
        {
            "gtfsAgencyId": "marylandtransitadministration",
            "onestopId": "o-dqc-marylandtransitadministration"
        },
        {
            "gtfsAgencyId": "mtaofficeoflocaltransitsupport",
            "onestopId": "o-dq-mtaofficeoflocaltransitsupport"
        }
    ],
    "sha1": "7d65a94ee0924e7a17b3d0ba1f481210e609b041",
    "tags": {},
    "url": "http://mta.maryland.gov/_googletransit/latest/google_transit.zip"
}